1,Adon olam,,,American Protestant
769,The Heavenly Feast,1994,,"Text Holocaust Poetry, Gjertrud Schnackenberg-DRS"
770,To the Spirit Unconquered,1992
771,Voices from Terezin,1993
772,Voices from the Shadow,1997,,"Ling. Ind. Other-German, Polish, Czech, French; text Holocaust Poetry, Rivka Basman-DRS"
773,Yizkor,1999,," ; JJ - removed duplicate of Yidn zingen ani mamin, which also appears in V9
774,A Singing of Angels,1973,,Date from Milken website AJH
775,Baroque Suite,1976,,"Date from Milken website AJH; text Medieval, Spanish-Hebrew Poetry, Yehuda Halevi-DRS"
776,Cantata from the Proverbs,1951,,Date from Milken website AJH
777,Psalm 81,1989,,Y
778,Psalms of Abraham,1980,,Date from Milken website AJH
779,Psalms of Israel,1973,,Date from Milken website AJH
780,Song of Songs,1942,,Date from Milken website AJH
781,The Day of Rest,1978,,"1978-Composition Year?-""The Day of Rest. Concert service for the Sabbath liturgy, for cantor, children’s choir, and orchestra. Dayton Ohio, 1978""- (https://en.wikipedia.org/wiki/Sylvan_Kalib#Publications_and_salient_works)-DRS"
782,A Woman of Valor,1977,,"According to composer's website, composed in 1977 and premiered in the following year AJH"
783,Adon Olam,1947,,Date from Worlcat score spelled as Adon olum AJH
784,Meditations,1997,,Date from composer's website (full piece title is: MEDITATIONS at the Time of the New Year) AJH